{
  "schema_version": 2,
  "artifact": "learning-change-status",
  "change_id": "<YYYY-MM-DD-kebab-topic>",
  "kind": "learning",
  "domain": "<domain-id>",
  "domain_type": "subject",
  "topic_id": "<topic-id>",
  "parent_change": null,
  "root_change": "<YYYY-MM-DD-kebab-topic>",
  "locator": "changes/<YYYY-MM-DD-kebab-topic>",
  "lifecycle": "active",
  "phase": "planning",
  "current_work": "learning/assess-and-plan",
  "works_run": [],
  "created_at": "<ISO-8601>",
  "updated_at": "<ISO-8601>",
  "closed_at": null,
  "archived_at": null,
  "closure_reason": null,
  "archive_path": null,
  "homework": {"status": "none", "latest_id": null, "submitted_at": null},
  "mastery": {
    "overall": "unverified",
    "immediate": "not_attempted",
    "retention": "not_scheduled",
    "critical_objectives": "not_attempted",
    "transfer": "not_attempted",
    "blocking_misconceptions": [],
    "evidence": [],
    "next_review_at": null
  },
  "children": [],
  "blockers": []
}
